id,title,author,follower_count,medium_url,clap_count,published_at,image_url,reading_time,uniqueSlug,isLocked
80e61041cd70,School Sports Matter. How to Make Them Matter More,Frederick M. Hess,22082,https://rickhess99.medium.com/school-sports-matter-how-to-make-them-matter-more-80e61041cd70,0,1710842547186,,6.652830188679245,school-sports-matter-how-to-make-them-matter-more-80e61041cd70,False
806ee6a82f39,Chemistry in Sports: The Science Behind Athletic Performance,Mary Doe,3223,https://medium.com/@mdoe06581/chemistry-in-sports-the-science-behind-athletic-performance-806ee6a82f39,0,1710265365259,0*fxMzZCP2AwIIM0eJ.jpg,2.1320754716981134,chemistry-in-sports-the-science-behind-athletic-performance-806ee6a82f39,True
7def85ed62dd,I can see that you and I are big fans of all the big leagues and all the big sports in the universe.,"Antonio Segovia, MD.",2434,https://doctorinvictus.medium.com/i-can-see-that-you-and-i-are-big-fans-of-all-the-big-leagues-and-all-the-big-sports-in-the-universe-7def85ed62dd,5,1710371508432,,0.26037735849056604,i-can-see-that-you-and-i-are-big-fans-of-all-the-big-leagues-and-all-the-big-sports-in-the-universe-7def85ed62dd,False
7bb4bca06546,Fascinating dive into the legacy and cultural impact of sports stadiums!,Borja Garcia,1492,https://medium.com/@fenixartstudio/fascinating-dive-into-the-legacy-and-cultural-impact-of-sports-stadiums-7bb4bca06546,9,1709365595999,,0.04150943396226415,fascinating-dive-into-the-legacy-and-cultural-impact-of-sports-stadiums-7bb4bca06546,False
7b0b5c5b398a,"You are so right, since sports are segregated it will continue.",Kim Fedyk,687,https://fedykkim.medium.com/you-are-so-right-since-sports-are-segregated-it-will-continue-7b0b5c5b398a,0,1709571054552,,0.07169811320754717,you-are-so-right-since-sports-are-segregated-it-will-continue-7b0b5c5b398a,False
79d5e6c228fb,The Role of Sports in Team Building: How Athletics Foster Collaboration and Communication,Stephanie Gray,2353,https://medium.com/@gray44863/the-role-of-sports-in-team-building-how-athletics-foster-collaboration-and-communication-79d5e6c228fb,50,1710254249471,0*06Dmml5hcgjjjPhv.jpg,2.449056603773585,the-role-of-sports-in-team-building-how-athletics-foster-collaboration-and-communication-79d5e6c228fb,True
79c7c6cafa4f,"Although there are sporadic instances of women competing with males in some sports, such as NASCAR…",Charlene Ann Mildred,5102,https://medium.com/@charleneannmildredfbarroga/although-there-are-sporadic-instances-of-women-competing-with-males-in-some-sports-such-as-nascar-79c7c6cafa4f,1,1710137704164,,0.12830188679245283,although-there-are-sporadic-instances-of-women-competing-with-males-in-some-sports-such-as-nascar-79c7c6cafa4f,False
79901a4498fd,"Adding you now, Gabriel. Welcome to the team! Looking forward to your sports memoir stories.",Mike Butler,7773,https://medium.com/@mlbutler_38162/adding-you-now-gabriel-welcome-to-the-team-looking-forward-to-your-sports-memoir-stories-79901a4498fd,15,1710736735025,,0.05660377358490566,adding-you-now-gabriel-welcome-to-the-team-looking-forward-to-your-sports-memoir-stories-79901a4498fd,False
75d0a4350b3a,Gender segregation in sports can be important for ensuring fair competition and accommodating…,Grace 🥀🥀🥀,827,https://medium.com/@madeha3400/gender-segregation-in-sports-can-be-important-for-ensuring-fair-competition-and-accommodating-75d0a4350b3a,0,1711806007282,,0.05660377358490566,gender-segregation-in-sports-can-be-important-for-ensuring-fair-competition-and-accommodating-75d0a4350b3a,False
7528e1ce432b,"Chronic Traumatic Encephalopathy, so the NFL and other sports instituted concussion protocols.",Marcus aka Gregory Maidman,2689,https://marcus17043.medium.com/chronic-traumatic-encephalopathy-not-sure-i-get-the-connection-youre-making-7528e1ce432b,50,1710972018906,,0.07547169811320754,chronic-traumatic-encephalopathy-not-sure-i-get-the-connection-youre-making-7528e1ce432b,False
741634b04f9c,"Yes, you do it well! And you hit my favorite topics--sports and memoirs!",Mike Butler,7773,https://medium.com/@mlbutler_38162/yes-you-do-it-well-and-you-hit-my-favorite-topics-sports-and-memoirs-741634b04f9c,0,1711902255599,,0.052830188679245285,yes-you-do-it-well-and-you-hit-my-favorite-topics-sports-and-memoirs-741634b04f9c,False
736375a5ac69,"As a sports mom, I have a bunch of stories to share.",Beth Dele,1107,https://medium.com/@bethdeles31/as-a-sports-mom-i-have-a-bunch-of-stories-to-share-736375a5ac69,1,1711562902958,,0.0830188679245283,as-a-sports-mom-i-have-a-bunch-of-stories-to-share-736375a5ac69,False
72fd7cc5eef0,Unlocking Your Inner Athlete: How to Improve Your Sports Performance,Jake Paul,1908,https://medium.com/@jakepaul12356789/unlocking-your-inner-athlete-how-to-improve-your-sports-performance-72fd7cc5eef0,1,1710250822098,0*KjMPRzZnl1qL-c0a.jpg,2.777358490566038,unlocking-your-inner-athlete-how-to-improve-your-sports-performance-72fd7cc5eef0,True
724258a9b6a2,Wow Sajjad never knew Cricket was the 2nd most watched sports thanks for sharing that. 😄,Yohan J.,1284,https://y-freeman.medium.com/wow-sajjad-never-knew-cricket-was-the-2nd-most-watched-sports-thanks-for-sharing-that-724258a9b6a2,0,1711672296610,,0.06037735849056604,wow-sajjad-never-knew-cricket-was-the-2nd-most-watched-sports-thanks-for-sharing-that-724258a9b6a2,False
6f3f39ac13f6,"This article effectively combines sports trivia with pop culture, making it an entertaining read…",Serhii Mikulenko,1550,https://medium.com/@FrontlineVoices/this-article-effectively-combines-sports-trivia-with-pop-culture-making-it-an-entertaining-read-6f3f39ac13f6,7,1709658805158,,0.07547169811320754,this-article-effectively-combines-sports-trivia-with-pop-culture-making-it-an-entertaining-read-6f3f39ac13f6,False
6e95ead47614,"Thanks, Bella, I appreciate your support always, and if you ever think of any sports-related post…",LARO ✨✨,2751,https://medium.com/@larocom/thanks-bella-i-appreciate-your-support-always-and-if-you-ever-think-of-any-sports-related-post-6e95ead47614,35,1711116998233,,0.09433962264150944,thanks-bella-i-appreciate-your-support-always-and-if-you-ever-think-of-any-sports-related-post-6e95ead47614,False
6e6ebd817f8c,You're going to get some more sports book reviews from me now that I know you might at times…,Janice Harayda,6287,https://janiceharayda.medium.com/youre-going-to-get-some-more-sports-book-reviews-from-me-now-that-i-know-you-might-at-times-6e6ebd817f8c,20,1709756071836,,0.08679245283018867,youre-going-to-get-some-more-sports-book-reviews-from-me-now-that-i-know-you-might-at-times-6e6ebd817f8c,False
6d5344c7d6c0,Sports people are so devoted to their fitness and goals.,JamieWrites,2914,https://medium.com/@JamieAd/sports-people-are-so-devoted-to-their-specialisms-6d5344c7d6c0,1,1709366255869,,0.03773584905660377,sports-people-are-so-devoted-to-their-specialisms-6d5344c7d6c0,False
6cd5b21661f3,How to Win at Sports Betting: A Guide for Beginners,Ilinka Anderson,860,https://medium.com/@ilinkaaioanei/how-to-win-at-sports-betting-a-guide-for-beginners-6cd5b21661f3,50,1711775392633,0*gxRgFzJrkVpq1OT6,2.5811320754716984,how-to-win-at-sports-betting-a-guide-for-beginners-6cd5b21661f3,True
684d72fa4547,"My understanding of gender in sports is that, although mixed-gender leagues might showcase…",Charlene Ann Mildred,5102,https://medium.com/@charleneannmildredfbarroga/my-understanding-of-gender-in-sports-is-that-although-mixed-gender-leagues-might-showcase-684d72fa4547,0,1709733847593,,0.20754716981132076,my-understanding-of-gender-in-sports-is-that-although-mixed-gender-leagues-might-showcase-684d72fa4547,False
66dfbde24676,Navigating New Waters: A Blue Ocean Sponsorship Strategy for Sports Organizations,Thomas Euler,3113,https://medium.com/liquiditeam/navigating-new-waters-a-blue-ocean-sponsorship-strategy-for-sports-organizations-66dfbde24676,0,1710923235584,0*LtgrfACDJAjErbVo,5.753144654088051,navigating-new-waters-a-blue-ocean-sponsorship-strategy-for-sports-organizations-66dfbde24676,False
64f054b1af79,Your sports commentaries are fun to read/listen to. 👍,Patricia Timmermans,2258,https://pjtimmermans.medium.com/your-sports-commentaries-are-fun-to-read-listen-to-64f054b1af79,5,1709751722838,,0.033962264150943396,your-sports-commentaries-are-fun-to-read-listen-to-64f054b1af79,False
6467202e6e73,I always LOVE writing sports and memoirs so it mixes my two loves.,Mike Butler,7773,https://medium.com/@mlbutler_38162/i-always-love-writing-sports-and-memoirs-so-it-mixes-my-two-loves-6467202e6e73,5,1711677260398,,0.22264150943396227,i-always-love-writing-sports-and-memoirs-so-it-mixes-my-two-loves-6467202e6e73,False
644ef65f74e8,"Versus-X: The Future of Sports Gaming will Have $300,000 $VSX IDO on Red Kite",Rin,5222,https://medium.com/polkafoundry/versus-x-the-future-of-sports-gaming-will-have-300-000-vsx-ido-on-red-kite-644ef65f74e8,1,1711012738794,0*lzfe89jU1sDhabYo,1.6981132075471697,versus-x-the-future-of-sports-gaming-will-have-300-000-vsx-ido-on-red-kite-644ef65f74e8,False
63fd14500a6c,The Future Unveiled: Web3 and Blockchain Revolution in the Football Industry,Zetly Fueling Sports,36317,https://zetly.medium.com/the-future-unveiled-web3-and-blockchain-revolution-in-the-football-industry-63fd14500a6c,0,1710765845217,1*ov3C2eNGQzuUINe_v4nMmg.png,12.984905660377358,the-future-unveiled-web3-and-blockchain-revolution-in-the-football-industry-63fd14500a6c,False
63e395b0cd8a,"Never been a big fan of sports, In my life I went to a few CUBS games in Chicago, Went to see the…",Georgette,470,https://medium.com/@georgettecornio/never-been-a-big-fan-of-sports-in-my-life-i-went-to-a-few-cubs-games-in-chicago-went-to-see-the-63e395b0cd8a,15,1711743590497,,0.4075471698113208,never-been-a-big-fan-of-sports-in-my-life-i-went-to-a-few-cubs-games-in-chicago-went-to-see-the-63e395b0cd8a,False
5cec2cdff8a4,"Thanks! And would love to add you to the team if you have any sports pieces, Amol!",Mike Butler,7773,https://medium.com/@mlbutler_38162/thanks-and-would-love-to-add-you-to-the-team-if-you-have-any-sports-pieces-amol-5cec2cdff8a4,5,1709318967758,,0.06415094339622641,thanks-and-would-love-to-add-you-to-the-team-if-you-have-any-sports-pieces-amol-5cec2cdff8a4,False
5c678cade8a5,The Science of Recovery: How to Bounce Back from Sports Injuries,Stephanie Gray,2353,https://medium.com/@gray44863/the-science-of-recovery-how-to-bounce-back-from-sports-injuries-5c678cade8a5,50,1710253452960,0*GFOhYWMgoNscQgij.jpg,2.626415094339623,the-science-of-recovery-how-to-bounce-back-from-sports-injuries-5c678cade8a5,True
5acd1186ae14,"While it is true that gender equality may be more readily achieved in non-contact sports, there…",Charlene Ann Mildred,5102,https://medium.com/@charleneannmildredfbarroga/while-it-is-true-that-gender-equality-may-be-more-readily-achieved-in-non-contact-sports-there-5acd1186ae14,1,1709543363262,,0.14339622641509434,while-it-is-true-that-gender-equality-may-be-more-readily-achieved-in-non-contact-sports-there-5acd1186ae14,False
5a555f46229a,"I have never been a big sports watcher - sure, I have my favorite teams, but not to the point where…",B. Wright,1268,https://stpchg.com/i-have-never-been-a-big-sports-watcher-sure-i-have-my-favorite-teams-but-not-to-the-point-where-5a555f46229a,0,1711493120663,,0.20754716981132076,i-have-never-been-a-big-sports-watcher-sure-i-have-my-favorite-teams-but-not-to-the-point-where-5a555f46229a,False
58caea0309a1,A lovely crafted poem about a sports person.,"Denise Larkin, BA (Hons)",4719,https://dlarkin121.medium.com/a-lovely-crafted-poem-about-a-sports-person-58caea0309a1,1,1710070560216,,0.1320754716981132,a-lovely-crafted-poem-about-a-sports-person-58caea0309a1,False
58204c694d1c,I am not remotely interested in sports—but this was gripping.,"Frances A. Chiu, Ph.D. | writing coach | editor",1359,https://medium.com/@francesachiu/i-am-not-remotely-interested-in-sports-but-this-was-gripping-58204c694d1c,22,1711697302554,,0.10566037735849057,i-am-not-remotely-interested-in-sports-but-this-was-gripping-58204c694d1c,False
5673ad890789,It is depressing to witness talents go unacknowledged because of gender prejudices in sports…,Charlene Ann Mildred,5102,https://medium.com/@charleneannmildredfbarroga/it-is-depressing-to-witness-talents-go-unacknowledged-because-of-gender-prejudices-in-sports-5673ad890789,0,1710229973262,,0.11320754716981132,it-is-depressing-to-witness-talents-go-unacknowledged-because-of-gender-prejudices-in-sports-5673ad890789,False
5624c93ffbf3,True sports fan,Scot Butwell,2532,https://medium.com/@butwellscot/true-sports-fan-5624c93ffbf3,1,1709605981594,,0.011320754716981131,true-sports-fan-5624c93ffbf3,False
55431137f695,Percentage of women on sports journalism courses rises,Behind Local News,964,https://medium.com/behind-local-news-uk/percentage-of-women-on-sports-journalism-courses-rises-55431137f695,0,1711195562251,1*N8iqO6JKmmLmrq8X89yeKA.png,1.5094339622641508,percentage-of-women-on-sports-journalism-courses-rises-55431137f695,False
54559af0c7d7,Sports Stars Making a Social Impact: Why & How MMA Pro Stephanie Mankin Is Helping To Change Our…,Authority Magazine Editorial Staff,1858,https://medium.com/authority-magazine/sports-stars-making-a-social-impact-why-how-mma-pro-stephanie-mankin-is-helping-to-change-our-54559af0c7d7,0,1710776831950,1*R7t97PzOoMiIys1LmHad7A.jpeg,8.891823899371069,sports-stars-making-a-social-impact-why-how-mma-pro-stephanie-mankin-is-helping-to-change-our-54559af0c7d7,False
53609ad64cbe,"Here's a thought, the other thing sports workers spend a lot of their time doing is talking to the…",Ted Jones,873,https://medium.com/@tedjones_41406/heres-a-thought-the-other-thing-sports-workers-spend-a-lot-of-their-time-doing-is-talking-to-the-53609ad64cbe,6,1711741895426,,0.2679245283018868,heres-a-thought-the-other-thing-sports-workers-spend-a-lot-of-their-time-doing-is-talking-to-the-53609ad64cbe,False
530f98a6635f,"The evolution of gender views in sports is an intriguing topic to think about, particularly in…",Charlene Ann Mildred,5102,https://medium.com/@charleneannmildredfbarroga/the-evolution-of-gender-views-in-sports-is-an-intriguing-topic-to-think-about-particularly-in-530f98a6635f,0,1709543325195,,0.16981132075471697,the-evolution-of-gender-views-in-sports-is-an-intriguing-topic-to-think-about-particularly-in-530f98a6635f,False
52b060ca6a5a,Gender-Based Sports Coverage: A Quarter Century of Prime-Time Summer Olympics,UF J-School,1596,https://medium.com/university-of-florida-college-of-journalism-and/gender-based-sports-coverage-a-quarter-century-of-prime-time-summer-olympics-52b060ca6a5a,0,1711557069877,1*rokEst_y30PFTto-4C-XVA.jpeg,3.69811320754717,gender-based-sports-coverage-a-quarter-century-of-prime-time-summer-olympics-52b060ca6a5a,False
52ab6d2daf0b,I agree! Sports can bring people together all over the world.,Elaine Gilmartin,806,https://ffaselaine.medium.com/i-agree-sports-can-bring-people-together-all-over-the-world-52ab6d2daf0b,50,1711843118018,,0.04150943396226415,i-agree-sports-can-bring-people-together-all-over-the-world-52ab6d2daf0b,False
5274d2203800,"Yes, he is named after Tom Brady. He is the only bird named after a local sports hero in my flock.",Sarah Ouellet,937,https://oldsal8904.medium.com/yes-he-is-named-after-tom-brady-he-is-the-only-bird-named-after-a-local-sports-hero-in-my-flock-5274d2203800,15,1710113115024,,0.07924528301886792,yes-he-is-named-after-tom-brady-he-is-the-only-bird-named-after-a-local-sports-hero-in-my-flock-5274d2203800,False
521f2866a481,"I'll keep an eye. I spotted it looking for sports stories. Yes, we will",Mike Butler,7773,https://medium.com/@mlbutler_38162/ill-keep-an-eye-i-spotted-it-looking-for-sports-stories-yes-we-will-521f2866a481,5,1710249885056,,0.052830188679245285,ill-keep-an-eye-i-spotted-it-looking-for-sports-stories-yes-we-will-521f2866a481,False
51873d544301,I can almost hear this conversation. Been hearing sports conversations my whole life. Nice drabble!,Nancy S Rust,608,https://medium.com/@nancy.rust63/i-can-almost-hear-this-conversation-been-hearing-sports-conversations-my-whole-life-nice-drabble-51873d544301,1,1711545912501,,0.05660377358490566,i-can-almost-hear-this-conversation-been-hearing-sports-conversations-my-whole-life-nice-drabble-51873d544301,False
4f3025aaaeb9,There is a lot of division over sports and so much more as far as I have heard!,Ryan Canady,4833,https://ryancanady.medium.com/there-is-a-lot-of-division-over-sports-and-so-much-more-as-far-as-i-have-heard-4f3025aaaeb9,20,1709322947581,,0.06792452830188679,there-is-a-lot-of-division-over-sports-and-so-much-more-as-far-as-i-have-heard-4f3025aaaeb9,False
4e786569a50c,Yes there is Ryan but the sports side is good humoured . The politics is somewhat trying at times .,LARO ✨✨,2751,https://medium.com/@larocom/yes-there-is-ryan-but-the-sports-side-is-good-humoured-4e786569a50c,0,1709626546773,,0.07547169811320754,yes-there-is-ryan-but-the-sports-side-is-good-humoured-4e786569a50c,False
4c3bdecc3526,It's still less of a butterfly effect than if we bet on sports.,Ryan Klemek,944,https://ryanklemek.medium.com/its-still-less-of-a-butterfly-effect-than-if-we-bet-on-sports-4c3bdecc3526,10,1711720263843,,0.04905660377358491,its-still-less-of-a-butterfly-effect-than-if-we-bet-on-sports-4c3bdecc3526,False
4b33c1999028,I didnt realize it but sports kept me out of deep depression.,Rampaging Turtle,4843,https://medium.com/@lamontar_35434/i-didnt-realize-it-but-sports-kept-me-out-of-deep-depression-4b33c1999028,0,1710273539752,,0.24150943396226415,i-didnt-realize-it-but-sports-kept-me-out-of-deep-depression-4b33c1999028,False
4a9e85045062,"I have a large collection of old sports cards, but I don't think they are worth anything. 😅",Marcus Musick,3891,https://marcusmusick75844.medium.com/i-have-a-large-collection-of-old-sports-cards-but-i-dont-think-they-are-worth-anything-4a9e85045062,14,1709665831365,,0.06792452830188679,i-have-a-large-collection-of-old-sports-cards-but-i-dont-think-they-are-worth-anything-4a9e85045062,False
4a88b7bd4c88,"In sports, it's important to pay attention to the skills and talents of each gender; after all…",Charlene Ann Mildred,5102,https://medium.com/@charleneannmildredfbarroga/in-sports-its-important-to-pay-attention-to-the-skills-and-talents-of-each-gender-after-all-4a88b7bd4c88,0,1709627378017,,0.23773584905660378,in-sports-its-important-to-pay-attention-to-the-skills-and-talents-of-each-gender-after-all-4a88b7bd4c88,False
4a7b61bb2e42,The Top 10 Sports Quotes That Will Inspire You to Greatness,Stephanie Gray,2353,https://medium.com/@gray44863/the-top-10-sports-quotes-that-will-inspire-you-to-greatness-4a7b61bb2e42,50,1710253550011,0*vlRMQ7j2_Iu7UiVV.jpg,2.966037735849057,the-top-10-sports-quotes-that-will-inspire-you-to-greatness-4a7b61bb2e42,True
4a2fd91b8d63,It's fascinating how various genders may contribute special abilities and qualities to sports…,Charlene Ann Mildred,5102,https://medium.com/@charleneannmildredfbarroga/its-fascinating-how-various-genders-may-contribute-special-abilities-and-qualities-to-sports-4a2fd91b8d63,1,1709800793355,,0.0830188679245283,its-fascinating-how-various-genders-may-contribute-special-abilities-and-qualities-to-sports-4a2fd91b8d63,False
46b2944ba691,"Lol. Ah, sports.",Stephanie Wilson,1912,https://medium.com/@stephaniewilson.virginia/lol-ah-sports-46b2944ba691,5,1710986977872,,0.1018867924528302,lol-ah-sports-46b2944ba691,False
4609c880273d,It's difficult to post a meaningful comment as the only thing I know about sports are the handsome…,Nevena Pascaleva,4501,https://nevenapascaleva.medium.com/its-difficult-to-post-a-meaningful-comment-as-the-only-thing-i-know-about-sports-are-the-handsome-4609c880273d,30,1709713241860,,0.07547169811320754,its-difficult-to-post-a-meaningful-comment-as-the-only-thing-i-know-about-sports-are-the-handsome-4609c880273d,False
43337c9cefb6,Artificial Intelligence Reveals Americans Demand Less Bitcoins in Sports Clubs and Arenas,Laxfed Paulacy,976,https://straightbias.com/artificial-intelligence-reveals-americans-demand-less-bitcoins-in-sports-clubs-and-arenas-43337c9cefb6,0,1710261682949,0*jRLheZBOv7Iu5bcm.png,3.033018867924528,artificial-intelligence-reveals-americans-demand-less-bitcoins-in-sports-clubs-and-arenas-43337c9cefb6,False
42d17d9e3830,"I like the sports analogy, Jon.🙌🏾",Georgina Odafe,1152,https://georginaodafe.medium.com/i-like-the-sports-analogy-jon-42d17d9e3830,0,1710913116084,,0.12452830188679245,i-like-the-sports-analogy-jon-42d17d9e3830,False
41682bd700cc,"Thanks, Adrienne! Yes, I think psychology is a big thing in sports too!",Randy Pulley,2765,https://medium.com/@randypulley4/thanks-adrienne-yes-i-think-psychology-is-a-big-thing-in-sports-too-41682bd700cc,0,1711715380894,,0.04905660377358491,thanks-adrienne-yes-i-think-psychology-is-a-big-thing-in-sports-too-41682bd700cc,False
3df01c1a650c,That’s a great song! Thanks for sharing it. I’ll have to check out some other sports. :),kasey sparks,2889,https://kaseysparks.medium.com/thats-a-great-song-thanks-for-sharing-it-i-ll-have-to-check-out-some-other-sports-3df01c1a650c,10,1711114738520,,0.06415094339622641,thats-a-great-song-thanks-for-sharing-it-i-ll-have-to-check-out-some-other-sports-3df01c1a650c,False
3b2bd0e7ac28,It was actually shocking to me later in life when I discovered I was pretty darn good at sports.,Walter Rhein,44922,https://walterrhein.medium.com/it-was-actually-shocking-to-me-later-in-life-when-i-discovered-i-was-pretty-darn-good-at-sports-3b2bd0e7ac28,10,1711286264795,,0.0830188679245283,it-was-actually-shocking-to-me-later-in-life-when-i-discovered-i-was-pretty-darn-good-at-sports-3b2bd0e7ac28,False
3a5ade6a9e71,The Top 10 Sports Drinks for Optimal Hydration and Performance,Jake Paul,1908,https://medium.com/@jakepaul12356789/the-top-10-sports-drinks-for-optimal-hydration-and-performance-3a5ade6a9e71,1,1710253061163,0*_dL2YTFSPYZwvDzs.jpg,2.2754716981132077,the-top-10-sports-drinks-for-optimal-hydration-and-performance-3a5ade6a9e71,True
37eb7f469f2f,A little red sports car!!!! That's the cherry on the cake. Thank you.,Michelle Scorziello,2856,https://michellescorziello.medium.com/a-little-red-sports-car-thats-the-cherry-on-the-cake-thank-you-37eb7f469f2f,50,1711718058733,,0.04905660377358491,a-little-red-sports-car-thats-the-cherry-on-the-cake-thank-you-37eb7f469f2f,False
3769dbf9fc37,"walking around and around the sports arena, a little high after a concert, how many red vw bugs are…",Ann James,1833,https://annjames-20427.medium.com/walking-around-and-around-the-sports-arena-a-little-high-after-a-concert-how-many-red-vw-bugs-are-3769dbf9fc37,0,1709503004674,,0.1018867924528302,walking-around-and-around-the-sports-arena-a-little-high-after-a-concert-how-many-red-vw-bugs-are-3769dbf9fc37,False
349bc6e344ce,"Denée, you describe beautifully how the pure joy of sports vanishes when money enters the picture.",Miriam Connolly,525,https://miz-connolly.medium.com/den%C3%A9e-you-describe-beautifully-how-the-pure-joy-of-sports-vanishes-when-money-enters-the-picture-349bc6e344ce,50,1711471524263,,0.09811320754716982,denée-you-describe-beautifully-how-the-pure-joy-of-sports-vanishes-when-money-enters-the-picture-349bc6e344ce,False
340792811a2e,Exciting tech for sports fans. Enjoy the article!,"Ali Alzahrani, M.Sc., Editor",5729,https://aliwritesaz.medium.com/exciting-tech-for-sports-fans-enjoy-the-article-340792811a2e,50,1711036439697,,0.03018867924528302,exciting-tech-for-sports-fans-enjoy-the-article-340792811a2e,False
306521234939,$500 USDT Prize Pool! Join EA SPORTS FC Tactical Indonesian Beta Test on CARV,CARV,17763,https://medium.com/@Carv/500-usdt-prize-pool-ea-sports-fc-tactical-joins-carv-infinite-play-306521234939,1,1711116569721,1*I2ox7L2Zn5zlLmlthePc-Q.png,1.6588050314465408,500-usdt-prize-pool-ea-sports-fc-tactical-joins-carv-infinite-play-306521234939,False
300fb22f3a68,When the weekend comes I finally get to do things I like. From my side job to Medium and sports,Every Day Life Improvement,5423,https://medium.com/@buasja/when-the-weekend-comes-i-finally-get-to-do-things-i-like-from-my-side-job-to-medium-and-sports-300fb22f3a68,5,1709383611254,,0.07547169811320754,when-the-weekend-comes-i-finally-get-to-do-things-i-like-from-my-side-job-to-medium-and-sports-300fb22f3a68,False
2ece2dd45497,"Dear friend as well, David for reading all my cliche-ridden coach pieces or other stuff with sports…",Mike Butler,7773,https://medium.com/@mlbutler_38162/dear-friend-as-well-david-for-reading-all-my-cliche-ridden-coach-pieces-or-other-stuff-with-sports-2ece2dd45497,0,1711071647995,,0.07169811320754717,dear-friend-as-well-david-for-reading-all-my-cliche-ridden-coach-pieces-or-other-stuff-with-sports-2ece2dd45497,False
2d9f166b15f8,University sports activities are enhanced by the distinct and exhilarating dynamic of mixed gender…,Charlene Ann Mildred,5102,https://medium.com/@charleneannmildredfbarroga/university-sports-activities-are-enhanced-by-the-distinct-and-exhilarating-dynamic-of-mixed-gender-2d9f166b15f8,0,1711529598281,,0.05660377358490566,university-sports-activities-are-enhanced-by-the-distinct-and-exhilarating-dynamic-of-mixed-gender-2d9f166b15f8,False
2d7572184699,Thank you so much. I played many sports and excelled at none :(,Jill Ebstein,3942,https://jebstein.medium.com/thank-you-so-much-i-played-many-sports-and-excelled-at-none-2d7572184699,50,1711678356532,,0.06415094339622641,thank-you-so-much-i-played-many-sports-and-excelled-at-none-2d7572184699,False
2d1d86c7979c,Sports betting is slightly less addictive than slots.,David Altaner,427,https://medium.com/@davidalta95_67721/sports-betting-is-slightly-less-addictive-than-slots-2d1d86c7979c,0,1711877735464,,0.12452830188679245,sports-betting-is-slightly-less-addictive-than-slots-2d1d86c7979c,False
